{
  "contract_version": "2.0.0",
  "artifact_type": "distilled_chunk",
  "chunk_id": "<copy from work queue>",
  "chunk_sha256": "<copy from source manifest>",
  "processing_status": "complete",
  "chunk_summary": "<agent-authored summary after reading the entire chunk>",
  "chunk_provenance": {
    "source_id": "<source id>",
    "start_line": 1,
    "end_line": 1,
    "page_range": []
  },
  "knowledge_nodes": [
    {
      "node_id": "<stable-node-id>",
      "expert_id": "<task-oriented-expert-id>",
      "title": "<node title>",
      "routing_priority": 100,
      "l0": {
        "trigger_terms": [{"term": "<short routing term>", "weight": 4}],
        "anti_trigger_terms": ["<similar request that should not select this expert>"],
        "one_liner": "<what this expert does>"
      },
      "l1": {
        "brief": "<concise knowledge and decision boundary>",
        "safety_red_lines": ["<must-not-cross boundary>"],
        "uncertainties": ["<known uncertainty; empty only when justified>"]
      },
      "l2": {
        "workflow": ["<imperative step>"],
        "load_more_if": ["<condition for reading L3/source chunks>"]
      },
      "l3": {"path": "distilled/l3/<expert-id>.md"},
      "risk_tags": [],
      "provenance": [
        {
          "chunk_id": "<known chunk id>",
          "source_id": "<known source id>",
          "start_line": 1,
          "end_line": 1,
          "claim": "<what these cited lines support>"
        }
      ]
    }
  ],
  "anti_trigger_notes": [
    {"term": "<global anti-trigger if any>", "action": "bypass", "scope": "global", "reason": "<reason>"}
  ],
  "uncertainties": ["<chunk-level uncertainty>"],
  "no_reusable_reason": ""
}
