{
  "contract_version": "2.0.0",
  "artifact_type": "distilled_chunk",
  "chunk_id": "chunk-9098d1d1be6b4b5effdd",
  "chunk_sha256": "43fc1396ef92f3fc0904f4576b29c6acc04318078a84af41a365658c710409df",
  "processing_status": "complete",
  "chunk_summary": "Semantic distillation is an agent/human task over every chunk; contracts require L0-L3, uncertainty, anti-triggers, and provenance before build.",
  "chunk_provenance": {
    "source_id": "src-ce2f45ce20bb732c",
    "start_line": 7,
    "end_line": 12,
    "page_range": []
  },
  "knowledge_nodes": [
    {
      "node_id": "semantic-distillation-core",
      "expert_id": "semantic-distillation",
      "title": "Chunk-complete semantic distillation",
      "routing_priority": 20,
      "l0": {
        "trigger_terms": [
          {"term": "semantic distillation", "weight": 7},
          {"term": "read every chunk", "weight": 7},
          {"term": "L0 L1 L2 L3", "weight": 6},
          {"term": "knowledge node", "weight": 5},
          {"term": "provenance", "weight": 4},
          {"term": "uncertainty", "weight": 3}
        ],
        "anti_trigger_terms": ["keyword extraction only"],
        "one_liner": "Require an agent to read every chunk and author complete L0-L3 nodes with uncertainty and line provenance."
      },
      "l1": {
        "brief": "Deterministic scripts enforce coverage and provenance, while semantic interpretation remains explicit agent/human work.",
        "safety_red_lines": ["Never market keyword extraction or deterministic chunking as semantic understanding."],
        "uncertainties": ["Semantic correctness still needs source-aware review beyond structural validation."]
      },
      "l2": {
        "workflow": [
          "Read the complete chunk identified by the queue item.",
          "Author reusable knowledge nodes with L0 triggers, L1 brief/red lines, L2 workflow, and an L3 module.",
          "Cite line ranges inside known chunks, record uncertainty and anti-triggers, then mark the work item complete.",
          "Run completeness validation before registry build."
        ],
        "load_more_if": ["A node depends on another chunk or the source meaning is uncertain."]
      },
      "l3": {"path": "distilled/l3/semantic-distillation.md"},
      "risk_tags": [],
      "provenance": [
        {
          "chunk_id": "chunk-9098d1d1be6b4b5effdd",
          "source_id": "src-ce2f45ce20bb732c",
          "start_line": 7,
          "end_line": 12,
          "claim": "Every chunk requires agent-authored L0-L3 artifacts and valid provenance before build."
        }
      ]
    }
  ],
  "anti_trigger_notes": [],
  "uncertainties": ["The validator proves structural completeness, not that every semantic interpretation is correct."],
  "no_reusable_reason": ""
}
